Date_Time,Admin,Event
2023-02-24 13:32:10.952010,Admin,"created staff, Asa's account"
2023-02-26 21:41:41.251783,Admin,"created staff, Tade's account"
2023-02-26 21:53:21.908073,Admin,"reactivated staff, {self.username}'s account"
2023-02-26 21:58:34.225711,Admin,"created staff, Sollypee's account"
2023-02-27 10:55:21.571424,Admin,"created staff, tella's account"
2023-02-27 11:05:12.992057,Admin,"created staff, Venza's account"
2023-02-27 13:14:54.641717,Admin,"created staff, Odunayo's account"
